[
  {
    "event_id": "evt-00001",
    "event_type": "ARTWORK_REGISTERED",
    "aggregate_type": "artwork",
    "aggregate_id": "artwork-daolang",
    "occurred_at": "2025-03-03T09:00:00+08:00",
    "version": 1,
    "summary": "青禾学校在地课程项目《稻浪墙》立项，落地地铁7号线B口通道墙",
    "actor": {
      "party_id": "party-teacher-li"
    },
    "payload": {
      "title": "稻浪墙",
      "site_id": "site-metro-line7-b-exit-wall",
      "lead_school_party_id": "party-school",
      "coordinator_party_id": "party-teacher-li",
      "curriculum_term_id": "term-2025-spring",
      "expected_lifetime_years": 6
    },
    "correlation_id": "flow-daolang-full-life"
  },
  {
    "event_id": "evt-00002",
    "event_type": "SITE_PERMIT_REQUESTED",
    "aggregate_type": "site_agreement",
    "aggregate_id": "site-metro-line7-b-exit-wall",
    "occurred_at": "2025-03-05T10:00:00+08:00",
    "version": 1,
    "summary": "学校向地铁站点管理部申请通道墙面使用许可",
    "actor": {
      "party_id": "party-teacher-li"
    },
    "payload": {
      "site_id": "site-metro-line7-b-exit-wall",
      "site_owner_party_id": "party-metro",
      "applicant_party_id": "party-school",
      "footprint": "B口通道北侧墙面 12m×2.6m",
      "use_period": "2025-04-01/2030-03-14"
    },
    "correlation_id": "flow-daolang-full-life"
  },
  {
    "event_id": "evt-00003",
    "event_type": "SITE_PERMIT_GRANTED",
    "aggregate_type": "site_agreement",
    "aggregate_id": "site-metro-line7-b-exit-wall",
    "occurred_at": "2025-03-12T15:00:00+08:00",
    "version": 2,
    "summary": "场地许可获批：保通行、不破防水、半年一巡检，进场前须完成施工安全报备",
    "actor": {
      "party_id": "party-metro"
    },
    "payload": {
      "site_id": "site-metro-line7-b-exit-wall",
      "permit_no": "metro7-b-2025-017",
      "valid_from": "2025-03-15",
      "valid_to": "2030-03-14",
      "obligations": [
        "保持通道净宽不小于1.8米",
        "不得破坏墙面防水层",
        "建成后每半年巡检一次"
      ],
      "require_safety_filing": true
    },
    "correlation_id": "flow-daolang-full-life"
  },
  {
    "event_id": "evt-00004",
    "event_type": "INPUT_COLLECTED",
    "aggregate_type": "site_agreement",
    "aggregate_id": "site-metro-line7-b-exit-wall",
    "occurred_at": "2025-03-16T09:30:00+08:00",
    "version": 3,
    "summary": "陈伯口述：村头打谷机是全队抢收时的中心，机声一响孩子都围过来",
    "actor": {
      "party_id": "party-teacher-zhou"
    },
    "payload": {
      "input_id": "input-chen-thresher",
      "kind": "interview",
      "collected_by_party_id": "party-teacher-zhou",
      "participant_party_id": "party-resident-chen",
      "themes": [
        "农耕记忆",
        "打谷机",
        "集体劳动"
      ],
      "media_uris": [
        "media-chen-audio-01"
      ],
      "content": "打谷机滚筒转起来，稻粒飞出来像金雨……",
      "summary": "陈伯回忆打谷机与集体抢收"
    },
    "correlation_id": "flow-daolang-full-life"
  },
  {
    "event_id": "evt-00005",
    "event_type": "INPUT_COLLECTED",
    "aggregate_type": "site_agreement",
    "aggregate_id": "site-metro-line7-b-exit-wall",
    "occurred_at": "2025-03-18T14:00:00+08:00",
    "version": 4,
    "summary": "王阿姨口述：晒谷场一片金黄，孩子们在谷堆间追跑",
    "actor": {
      "party_id": "party-teacher-zhou"
    },
    "payload": {
      "input_id": "input-wang-sunning",
      "kind": "interview",
      "collected_by_party_id": "party-teacher-zhou",
      "participant_party_id": "party-resident-wang",
      "themes": [
        "晒谷场",
        "丰收",
        "童年"
      ],
      "media_uris": [
        "media-wang-audio-01"
      ],
      "content": "放学路过晒谷场，金黄金黄的。",
      "summary": "王阿姨回忆晒谷场童年"
    },
    "correlation_id": "flow-daolang-full-life"
  },
  {
    "event_id": "evt-00006",
    "event_type": "INPUT_COLLECTED",
    "aggregate_type": "site_agreement",
    "aggregate_id": "site-metro-line7-b-exit-wall",
    "occurred_at": "2025-03-20T11:00:00+08:00",
    "version": 5,
    "summary": "学生小米访谈：每天放学经过这面墙，想看到风吹稻浪的样子",
    "actor": {
      "party_id": "party-teacher-li"
    },
    "payload": {
      "input_id": "input-mi-ricewave",
      "kind": "interview",
      "collected_by_party_id": "party-teacher-li",
      "participant_party_id": "party-student-mi",
      "themes": [
        "放学路",
        "稻浪"
      ],
      "media_uris": [
        "media-mi-audio-01",
        "media-mi-photo-01"
      ],
      "content": "我想要墙像真的稻浪一样。",
      "summary": "小米描述想象中的稻浪墙"
    },
    "correlation_id": "flow-daolang-full-life"
  },
  {
    "event_id": "evt-00007",
    "event_type": "INPUT_COLLECTED",
    "aggregate_type": "site_agreement",
    "aggregate_id": "site-metro-line7-b-exit-wall",
    "occurred_at": "2025-03-24T18:00:00+08:00",
    "version": 6,
    "summary": "公众意见（联署86人中61人提及）：希望做发光网红字，方便夜间打卡",
    "actor": {
      "party_id": "party-community"
    },
    "payload": {
      "input_id": "input-pub-neon",
      "kind": "public_comment",
      "collected_by_party_id": "party-community",
      "anon_label": "市民意见箱汇总",
      "themes": [
        "夜间发光字",
        "打卡"
      ],
      "source_channel": "站点意见箱",
      "summary": "多数公众留言希望做发光字"
    },
    "correlation_id": "flow-daolang-full-life"
  },
  {
    "event_id": "evt-00008",
    "event_type": "INPUT_COLLECTED",
    "aggregate_type": "site_agreement",
    "aggregate_id": "site-metro-line7-b-exit-wall",
    "occurred_at": "2025-03-25T18:00:00+08:00",
    "version": 7,
    "summary": "公众意见：通道早晚人流密集，装饰物不能凸出墙面、不能有眩光",
    "actor": {
      "party_id": "party-community"
    },
    "payload": {
      "input_id": "input-pub-passage",
      "kind": "public_comment",
      "collected_by_party_id": "party-community",
      "anon_label": "早晚通勤乘客",
      "themes": [
        "通道净宽",
        "眩光",
        "通行安全"
      ],
      "source_channel": "居民议事会",
      "summary": "通勤乘客关注通行与眩光安全"
    },
    "correlation_id": "flow-daolang-full-life"
  },
  {
    "event_id": "evt-00009",
    "event_type": "PUBLIC_INPUT_SUMMARY_PUBLISHED",
    "aggregate_type": "site_agreement",
    "aggregate_id": "site-metro-line7-b-exit-wall",
    "occurred_at": "2025-03-30T17:00:00+08:00",
    "version": 8,
    "summary": "意见汇总发布：86条意见，发光字呼声最高；汇总仅为调查记录，不作为表决结论",
    "actor": {
      "party_id": "party-teacher-zhou"
    },
    "payload": {
      "period": "2025-03-15/2025-03-29",
      "comment_count": 86,
      "themes": [
        [
          "夜间发光字",
          61
        ],
        [
          "农耕记忆",
          34
        ],
        [
          "通行与眩光安全",
          22
        ],
        [
          "稻浪意象",
          18
        ]
      ],
      "note": "意见多少不自动决定方案，取舍由设计方结合场地安全与耐久性判断，并记录理由"
    },
    "correlation_id": "flow-daolang-full-life"
  },
  {
    "event_id": "evt-00010",
    "event_type": "DESIGN_REVISION_PROPOSED",
    "aggregate_type": "design_revision",
    "aggregate_id": "design-daolang",
    "occurred_at": "2025-04-02T10:00:00+08:00",
    "version": 1,
    "summary": "设计第一稿：以稻浪浮雕为主体，嵌入旧打谷机构件",
    "actor": {
      "party_id": "party-teacher-zhou"
    },
    "payload": {
      "artwork_id": "artwork-daolang",
      "revision_no": 1,
      "based_on_input_ids": [
        "input-chen-thresher",
        "input-wang-sunning",
        "input-mi-ricewave",
        "input-pub-neon",
        "input-pub-passage"
      ],
      "proposal": "哑光陶粒浮雕稻浪+旧打谷机金属构件嵌入，不凸出墙面超过3cm"
    },
    "correlation_id": "flow-daolang-full-life"
  },
  {
    "event_id": "evt-00011",
    "event_type": "DESIGN_TRADEOFF_RECORDED",
    "aggregate_type": "design_revision",
    "aggregate_id": "design-daolang",
    "occurred_at": "2025-04-05T10:00:00+08:00",
    "version": 2,
    "summary": "夜间效果取舍：发光字支持人数最多，但因眩光与行车视线安全未中选",
    "actor": {
      "party_id": "party-teacher-zhou"
    },
    "payload": {
      "revision_no": 1,
      "issue": "夜间视觉效果",
      "options": [
        {
          "option": "A-led-characters",
          "support_count": 61,
          "note": "发光网红字，夜间打卡效果强"
        },
        {
          "option": "B-matte-relief",
          "support_count": 18,
          "note": "哑光陶粒稻浪，借站点照明反光柔和"
        },
        {
          "option": "C-mirror-metal",
          "support_count": 7,
          "note": "镜面金属，眩光风险高"
        }
      ],
      "chosen_option": "B-matte-relief",
      "rationale": "通道紧邻行车区段，发光字与镜面材料将造成眩光；哑光浮雕在站点照明下可读且耐久。支持人数高不构成中选理由。",
      "decided_by_party_id": "party-teacher-zhou"
    },
    "correlation_id": "flow-daolang-full-life"
  },
  {
    "event_id": "evt-00012",
    "event_type": "DESIGN_DECIDED",
    "aggregate_type": "design_revision",
    "aggregate_id": "design-daolang",
    "occurred_at": "2025-04-08T16:00:00+08:00",
    "version": 3,
    "summary": "设计定稿：采纳稻浪与打谷机记忆、通行安全意见；不采纳发光字并书面说明理由",
    "actor": {
      "party_id": "party-teacher-zhou"
    },
    "payload": {
      "revision_no": 1,
      "decision": "定稿",
      "adopted_input_ids": [
        "input-chen-thresher",
        "input-wang-sunning",
        "input-mi-ricewave",
        "input-pub-passage"
      ],
      "rejected_inputs": [
        {
          "input_id": "input-pub-neon",
          "reason": "发光字在通道内形成眩光，且需外接电源，不满足场地安全义务"
        }
      ],
      "rationale": "公共艺术意见征集是设计输入而非方案表决；最终判断以场地安全义务、在地记忆代表性和耐久可维护性为准。",
      "decided_by_party_id": "party-teacher-zhou"
    },
    "correlation_id": "flow-daolang-full-life"
  },
  {
    "event_id": "evt-00013",
    "event_type": "CONTRIBUTOR_REGISTERED",
    "aggregate_type": "contribution_record",
    "aggregate_id": "contribution-daolang",
    "occurred_at": "2025-04-10T09:00:00+08:00",
    "version": 1,
    "summary": "登记参与者：青禾学校",
    "payload": {
      "party_id": "party-school",
      "kind": "school",
      "display_name": "青禾学校"
    },
    "correlation_id": "flow-daolang-full-life"
  },
  {
    "event_id": "evt-00014",
    "event_type": "CONTRIBUTOR_REGISTERED",
    "aggregate_type": "contribution_record",
    "aggregate_id": "contribution-daolang",
    "occurred_at": "2025-04-10T09:00:00+08:00",
    "version": 2,
    "summary": "登记参与者：地铁集团站点管理部",
    "payload": {
      "party_id": "party-metro",
      "kind": "site_owner",
      "display_name": "地铁集团站点管理部"
    },
    "correlation_id": "flow-daolang-full-life"
  },
  {